title,company,location,post_date,salary,summary,link,description
Claims Assistant,Sacramento Superior Court,"Sacramento, CA 95826 (College-Glen area)",2021-10-25,,"Under general direction, performs a wide variety of specialized clerical and technical administrative duties for judicial officers, subordinate judicial…",https://www.indeed.com/rc/clk?jk=f2d258dda6c72ad3&fccid=550f95a2595548e2&vjs=3,"Description
Under general direction, performs a wide variety of specialized clerical and technical administrative duties for judicial officers, subordinate judicial officers, executive officers, and Court staff requiring thorough knowledge of Court procedures and operations; composes and prepares correspondence using considerable judgment in content and style; performs skilled word processing, data entry and organization, telephone and counter reception, processing of invoices, recordkeeping, technical report preparation, and filing; provides information to the public; and performs related duties as assigned.
Examples of Duties
Note: Duties may include, but are not limited to the following:

Performs a wide variety of confidential and sensitive administrative work for judicial officers, subordinate judicial officers, executive officers, and Court Staff, including drafting memos and legal documents, making training and travel arrangements, preparing agendas and informational packets, setting up meeting and training rooms, and taking and transcribing minutes.

Reviews, processes, tracks and provides sensitive detailed and technical forms, files, records and reports associated with multiple Rules of Court, policies, and procedures pertaining to judicial officers, prepares related reports and queries for judicial officers.

Assists Court staff in researching, compiling, analyzing, and developing information for projects, studies, and reports from a variety of resources; interprets Court policy on routine administrative matters and explains procedures to others.
Performs various basic accounting/bookkeeping work which includes verifying or computing financial data, preparing billing invoices, reconciliation and reimbursement for CAL-Card purchases, travel reimbursement, etc.

Coordinates a variety of special events and meetings for judicial officers including awards, events honoring judicial officers, investitures and retirements, magistrate duty, new Judge orientation, etc.; contacts venues about facilities and services; conducts research, makes site visits, and finds resources to help with decisions about event possibilities; serves as a liaison with vendors on event-related matters.

Assists with coordinating on site set-up and clean-up for events, as necessary; prepares invitations, nametags, materials, registration lists, and seating cards; assists with preparing event budgets and provides progress reports for each event; monitors event finances; coordinates appointments and scheduling of events.

Performs other clerical/administrative work as required, which may include but is not limited to copying documents, filing/retrieving files, reviewing and processing mail, faxing information, serving as a receptionist at the front counter, maintaining calendars, maintaining law libraries, maintaining inventory of supplies and materials, etc.

Prepares binders, pamphlets, and other materials for meetings and programs; compiles, copies and distributes information/document packets for presentations, ensuring completeness and accuracy of contents.

Communicates with Court officials and staff of other internal and external stakeholders to obtain and relay information and to coordinate activities.

Performs special projects as requested by judicial officers, subordinate judicial officers, executive officers, and Court staff.

Performs related duties as assigned.
Minimum Qualifications
A typical way of obtaining the required knowledge and abilities is equivalent to:

Experience: One (1) year of experience in the class of Judicial Secretary III in the Sacramento Superior Court or a comparable class in government service.

Or II
Experience: Two (2) years of experience in the class of Judicial Secretary II or Secretary (Confidential) in the Sacramento Superior Court or a comparable class in government service.

Or III
Experience: Four (4) years of increasingly responsible office support experience.
Substitution: Education from an accredited college, business school or training school that is directly related to the knowledge and abilities specified for this class may be substituted for a maximum of two (2) of the four (4) years of increasingly responsible office support experience.

PHYSICAL REQUIREMENTS

Must possess mobility to work in a standard office setting and use standard office equipment, including a computer; vision to read printed material and a computer screen; and hearing and speech to communicate in person, before groups, and over the telephone. This is primarily a sedentary office classification, although standing and walking between work areas may be required. Finger dexterity is needed to access, enter, and retrieve data using a computer keyboard or calculator, and to operate standard office equipment. Positions in this classification occasionally bend, stoop, kneel, reach, push and pull drawers open and closed to retrieve and file information. Employees must possess the ability to occasionally lift, carry, push and pull materials and objects up to 25 pounds. Reasonable accommodations will be made for individuals on a case-by-case basis.
Knowledge of:

The court system and organization, functions, rules, policies, and procedures applicable to administrative and court operations.
Protocol for elected officials in a political environment.
Rules and methods of court administration related to judicial officer requirements.
Applicable federal, state, and local laws, regulatory codes, ordinances, and procedures relevant to assigned area of responsibility.
Methods of preparing and processing various records, reports, forms, and other legal documents.
Administrative survey techniques and skill in their application.
Methods and techniques used for basic legal research and other administrative information.
Event planning, negotiations, and preparation.
Techniques for providing a high level of customer service by effectively dealing with Court staff and the public.
Correct English usage, spelling, grammar, punctuation, and sentence structure to ensure that written materials prepared and reviewed are complete, concise, and error-free.
General computer and office software, including word-processing, email, databases, and spreadsheets.

Ability to:

Plan, organize, and prioritize the full scope of administrative projects rapidly and accurately with minimal supervision and under tight time constraints.
Maintain confidentiality of sensitive information received.
Be flexible and change assignments or direction on a moment’s notice; determine multiple priorities quickly.
Review situations accurately and determine appropriate courses of action using judgment according to established policies and procedures.
Understand, interpret, and apply a variety of pertinent administrative and departmental laws, codes, regulations, policies and procedures, and standards relevant to work performed.
Research, gather, evaluate, and organize information; prepare documents, reports, and/or spreadsheets.
Organize and maintain accurate, current, and complete records and specialized files.
Proofread and edit materials to identify grammatical and consistency errors.
Represent the Court in a professional manner using tact, initiative, discretion, and diplomacy in sensitive situations.
Establish, maintain, and foster positive and effective working relationships with judicial officers, Court staff, the public, numerous outside entities and representatives of the public.
Recognize and respect limits of authority.
Remain calm and maintain composure in highly stressful situations.
Communicate clearly and concisely, both orally and in writing, using appropriate English grammar and syntax.
Effectively use computer systems, software applications, and modern business equipment to perform a variety of work tasks.
Other Information
Must be able to pass a criminal history information background check.

The following is an explanation of the benefits, which apply to those employed in regular or limited-term positions:

Vacation: Vacation with pay varies depending upon the employee representation unit. New employees typically earn 10 days per year and accrual rates normally increase according to years of service.

Holidays: The Superior Court of California, County of Sacramento recognizes 13 ½ holidays and 2 floating holidays per year.

Sick Leave: Employees accrue 4.6 hours per bi-weekly pay period, equivalent to 15 days per year.

Parental Leave: Employees with at least 1 year of service are eligible for paid parental leave upon the birth or adoption of a child.

Retirement: Employees are covered by the Sacramento County Employee's Retirement System (SCERS) and Social Security.

Group Health Insurance: The Court offers several choices of employee and dependent health insurance coverage, with a significant portion paid by the employer.

Dental and Vision Services Plan: Employee and dependent dental and vision insurance plans are provided at no cost.

Life Insurance: Basic employee life insurance is provided at no cost to the employee with additional optional life insurance available at the employee's cost.

Medical and Childcare Flexible Spending Accounts: The ability to deduct a portion of your salary before taxes to apply toward medical expenses and/or child care expenses.

Deferred Compensation: The Court offers a Deferred Compensation Program.

Sacramento Credit Union: The credit union offers loan facilities and systematic savings plans through payroll deduction.

Tuition Reimbursement: The Court reimburses up to $2,400.00 dollars of an employee's educational expenses as outlined in its Tuition Reimbursement policy.

Long Term Disability: A Long Term Disability (LTD) plan is provided at no cost to employees.

Transit Subsidy: The Court provides a transit subsidy to eligible employees based on current policy."
Claims Assistant,City of Sacramento,"Sacramento, CA 95814 (Downtown area)",2021-10-30,,"Receive payments, make change, issue receipts and print-out account statements for permits, licenses, citation transactions, taxes and service accounts; issue,…",https://www.indeed.com/rc/clk?jk=c6d5f57dfc718936&fccid=700c8bc235f6a06b&vjs=3,"THE POSITION
The City of Sacramento requires all newly appointed employees to be fully vaccinated against COVID-19 as a condition of employment.

PERS retired annuitants or individuals currently receiving CalPERS Retirement Benefits are not eligible to apply.

To perform a variety of record keeping, general clerical, transaction processing, and public contact and customer service work over the telephone and at a public counter; and direct information requests according to established standards and procedures.

This is the entry-level class in the Customer Service series. Incumbents perform duties similar to a Customer Service Representative, but would lack a complete knowledge of unit procedures and standards, and not yet able to perform the full range of duties without immediate supervision. Incumbents have at least one year of experience performing a wide variety of general clerical, customer services, and public contact duties. This class may be used as a training class for flexibly staffed positions. This class is distinguished from the Customer Service Representative in that the latter is the journey level class in the series, and upon appointment to the higher-level class requires that the employee be performing the full range of duties for the class and meet the qualification standards for the class.

Immediate supervision is provided by a Customer Service Supervisor or higher-level staff. Lead direction may be provided by higher-level staff.
ESSENTIAL DUTIES AND RESPONSIBILITIES
Perform a variety of duties, including typing, proofreading, billing, checking, filing, record keeping, sorting and retrieving documents and records, mail/correspondence, maintaining alphabetical, index, and cross-reference files; folds, staples stuffs and binds a variety of materials for bulk mailings; maintain general mailing lists, registration and other information.
Represent the City and the department to the public, callers, and visitors in a professional and effective manner over the telephone and at a public counter; take and respond to a high volume of phone calls; follow general customer service policy and procedure; may act as receptionist; provide information on department and division policies and procedures.
Receive and respond to customer inquiries; screen calls, take messages and complaints, refer customers to appropriate persons regarding services and accounts, and department business lines, including fees, licenses, permits and billing information; provide follow-up on inquiries from the public or staff; and refer or assist in the resolution of problems.
Utilize various systems to locate information, retrieve, research and review find out the status of accounts; create or make adjustments to service requests on property/parcels; update billing accounts to provide accurate billing information; update systems and run reports of various computer systems; research and establish correct ownership, change ownership information and deed date; generate inspections to establish ownership; correct service records and repair orders received from field crews.
Operate 2-way radio or other telecommunication device; perform non-safety radio dispatch in order to dispatch field staff, equipment or vehicles to locations as needed; prioritize calls; and obtain and record information and keep radio contact with field personnel.
Receive payments, make change, issue receipts and print-out account statements for permits, licenses, citation transactions, taxes and service accounts; issue, receive, type and process various applications, license, permits and other forms; input debit applications and cancellation information to customer accounts; issue refunds, notices and other related documents and information within established procedures; and update service accounts, permit, license and citation information systems.
Receive, open and process mail containing fees for various City services, including licenses, permits, citation payments, and utility payments; process outgoing correspondence and credit card payments.
Gather information from customers and complete appropriate property/parcel forms necessary to establish and stop services; adjust and reconcile records and billing as necessary to reflect changes in service; verify accuracy, waive penalties, and may perform collection efforts on delinquent accounts for City services, fees, licenses, permits and taxes.
Operate standard office equipment such as a telephone, calculator, typewriter, personal computer, facsimile machine, microfiche and microfilm readers, remittance processors, money counting machines, electronic cash registers, adding machine, and other office equipment.
Perform notary services.
Assist in the training of other employees.
Provide exceptional customer service to those contacted in the course of work.
Other related duties may also be performed; not all duties listed are necessarily performed by each individual.
QUALIFICATIONS
Knowledge of:

English usage, spelling, grammar, and punctuation.
Proper public and telephone contact practices.
Basic financial record keeping procedures and methods.
Methods and equipment used in processing payment and other fees.
Modern office practices, procedures and equipment, including filing systems.
Basic mathematical principles and procedures.
Assessing parcel maps, as assigned.
Computer operations, including computer software applications and other specialized business applications.
Organization, procedures and operating details of City department to which assigned.

Skills in:
Computer keyboard, typewriter and 10-key calculator.
Working as part of a team.
Phone skills and diplomacy.
Computer and Internet searches.

Ability to:
Exercise tact, judgment and patience in dealing with the public, staff and client departments.
Be flexible with changes in policies and procedures
Work under pressure.
Operate standard office equipment, including adding machine, personal computers, 2-way radio and other office equipment.
Interpret and apply City regulations and procedures as applicable to billing, fees and collections.
Learn the organization, procedure and operation details of assigned department/section.
Use a variety of business software applications in order to complete assigned duties in a timely manner.
Use good judgment in the application of City policies, regulations and procedures relative to assigned division.
Work any shift, including weekends and holidays is mandatory for some assignments.
Maintain appropriate records and reports.
Type at a speed of not less than 35 net words per minute.
Perform mathematic calculations.
Understand and follow oral and written instructions.
Work with minimal supervision.
Speak clearly and concisely.
Work with a diverse group.
Establish and maintain effective working relationships with those contacted in the course of work.
Learn to perform concurrently multiple customer service related duties.

EXPERIENCE AND EDUCATION

Any combination of experience and education that would provide the required knowledge and abilities is qualifying. A typical way to obtain the knowledge and abilities would be:

Experience:

One year of responsible experience performing a wide variety of general clerical, public contact, and customer service work providing information and/or directing request over the telephone and at a public counter.

Education:

Equivalent to the completion of the twelfth grade.

PROBATIONARY PERIOD:

Employees must complete twelve (12) months of probation at a satisfactory performance level prior to gaining permanent status.
THE SELECTION PROCEDURE
Please note, the City of Sacramento's preferred method of communication with applicants is via e-mail. As such, please ensure you verify the e-mail address on your application, and check your e-mail frequently, including your spam and junk folders. All e-mail notifications can also be accessed through the governmentjobs.com applicant inbox.
1. Application: (Pass/Fail) – All applicants must complete and submit online a City of Sacramento employment application by the final filing deadline;
Employment applications must be submitted online; paper applications will not be accepted.
Employment applications will be considered incomplete and will be disqualified:
If applicants do not list current and/or past job-related experience in the duties area of the ""Work Experience"" section. Note: Qualifying experience is based on 40 hours per week (pro-rated if less than 40 hours/week).
If ""see resume"" is noted in the ""Work Experience"" section; a resume will not substitute for the information required in the ""Work Experience"" section.
Proof of education such as, but not limited to, university/college transcripts and degrees should be submitted online with your application. Proof of education will be required at time of appointment.,
Position/job titles will not be considered in determining eligibility for meeting the minimum qualifications for this position.
If you’re requesting Veteran’s credit, a copy of your DD214 must be submitted online with your application or sent to the Employment Office by email/fax or mailed by the final filing deadline. Information regarding the use of Veteran’s credit can be found in the Civil Service Board rules under rule 4.9C.
Applicants are responsible for attaching a copy of their DD214 to each position for which they apply.
2. Screening Committee: (Pass/Fail)– Human Resources will evaluate employment applications for the minimum qualifications stated on the job announcement.
3. Online Exam: (Weighted 100%) – Qualified candidates will receive a notification via email when the examination is available. Candidates will have approximately 7 calendar days from the date of notification to complete the online examination. Only one attempt will be permitted. The online examination will be job related and may include, but not limited to, the knowledge and abilities as outlined above. Candidates who PASS the online exam MAY be invited to take a confirmatory exam at the hiring departments discretion.
4. Eligibility: Candidates who pass the online examination will be placed on the eligible list. The hiring department may contact candidates for interview at any time during the life of the one-year list.
5. Typing Certificate: (Pass/Fail) – Proof of a valid typing certificate with a minimum score of 35 net words per minute should be submitted with your application and will be required at time of appointment. You do NOT need a certificate in order to apply. Certificate must be submitted prior to beginning work;
A valid typing certificate must indicate a minimum score of 35 net words per minute.
For more information on typing certificate requirements and where to obtain a valid typing certificate, visit the following link: http://www.cityofsacramento.org/HR/Divisions/Talent-Acquisition-and-Workforce-Development/Applicant-Resources
6. Conditional Hire: Upon receipt of a conditional offer, the selected candidate must complete and pass Live Scan/fingerprinting; and provide proof of receiving a complete COVID-19 vaccination. If applicable, candidates may also need to pass a pre-employment medical exam, controlled substance and/or alcohol test, and possess any required licensure or certification prior to receiving a start date from the Department. Failure to meet these prerequisites will be grounds for withdrawal of your conditional offer of employment.

QUESTIONS: For questions concerning this job announcement and the application process: · Please visit https://www.governmentjobs.com/Home/ApplicationGuide for a comprehensive, step-by-step guide to the application process.
For technical support between 6 AM - 5 PM PT, contact Live Applicant Support at (855) 524-5627.
Visit the City of Sacramento Human Resources Department website at http://www.cityofsacramento.org/HR/Career-Opportunities
Send an email to employment@cityofsacramento.org or
Call the Human Resources Department at (916) 808-572

Bilingual Pay
Did you know that the City offers bilingual pay? That's right, most labor agreements offer the option of providing employees with bilingual pay if the department deems it to be operationally necessary.

Pension Reform Act
The City of Sacramento is covered by the California Public Employees' Retirement System, and as such, must adhere to the California Public Employee's Pension Reform Act (PEPRA) of 2013. Please note that the provisions within this act may affect or impact an applicant's eligibility and/or selection for open vacancies at the City of Sacramento.

Equal Opportunity Employer
The City of Sacramento is an equal opportunity employer to all, regardless of age, ancestry, color, disability (mental and physical), exercising the right to family care and medical leave, gender, gender expression, gender identity, genetic information, marital status, medical condition, military or veteran status, national origin, political affiliation, race, religious creed, sex (includes pregnancy, childbirth, breastfeeding and related medical conditions), and sexual orientation.

Additional Information
Civil Service Rules: http://portal.cityofsacramento.org/HR/Divisions/Administration/HR-Boards-Commissions/Civil-Service-Board
Union Contracts: http://portal.cityofsacramento.org/HR/Divisions/Labor-Relations/Labor-Agreements

Salary Schedule: http://portal.cityofsacramento.org/HR/Document-Library"
