title,company,location,post_date,salary,summary,link,description
newDelivery Van Driver - No Experience Required!,Amazon Delivery Service Partners,"Rancho Cordova, CA 95741+9 locations",2021-11-05,,"Must have a valid driver's license within the state of employment.
Professional growth: many DSPs offer career growth opportunities such as moving into Lead…",https://www.indeed.com/pagead/clk?mo=r&ad=-6NYlbfkN0BmyusN3AZrnrz6ETKGX79Q_64LOmeJ24CVzIK7012grY3gZ2U9rBA1JjdU0mML9EYRSbtmFASSQrOznOkKWuXh_Pp1Tf5Sf9QBn1tAfouACXhtEEhpD248BBZV_H9xrIT3LeD8AtaBlmTQAPK4W1sDiy7RltkHB4wury0ig2_x9f8viryr8JL_wzK1lfxprudSfz7fWQ_nVr5lNyoWitj2rndqAeanIeB6kTctLQXP3q6ZtIf1PVT52BzbtOJV-l7lkmuNoMmEqCFvSBlIEN02R0wNUhwhz1iJVVZj-zLcRqW2jjEW_i_lmllQkIlH3zO6o6k7ZN4OvbI6mjDd9Dq2wKK2gdJUST23vWXv9YkuM-OxOetUU62ST22uBG0qpINgC3Ox7E7DuZ2xCOujuFKsQ7v06_lfBu6k6Dz3I_w5-UP9BKlX5CxYeBHo5aim4Z2rJgFIk9SIEc_DSfbABLP_x1DoVWiznVrDlF-UbYbHN_BEGo9uWP9xNitjlC6nNdd-qsFjjNW2psowZEpmhZBjjYl23Gvka1CHnJsWNY-5JgF1PqIeIlCs0Ae-AzLRIdqhSyCR8IbzkUqPfR2Y6JEbBdfpHoL5jzNkk8QmWY-r8tnNvXyEly3iq_bOaMyECgiPGqJ2QZfgNqLsgzC6QeOacMVr3cbfmoDGyZvk3n22TXwD_73b8OrVGlGETDFfUi1-Hp9iwIdvEuahKp9LKlMQeAxQggD1SWE=&p=0&fvj=0&vjs=3,"Delivery Associate – DSR4 Elk Grove, CA (Starting Pay $17.50/hr+) - Amazon Delivery Service Partners

Shifts: Morning, afternoon, weekday and/or weekend
Location: DSR4 - Elk Grove - 9051 Union Park Way and Iron Rock Way south of Union Park Way, Elk Grove, CA
Compensation: Starting pay $17.50/hr + benefits

Are you interested in a new opportunity where you can work independently, make a difference in your community, and delight hundreds of customers every day? Apply to be a Delivery Driver for an Amazon Delivery Service Partner (DSP) today. DSPs provide contracted delivery services to Amazon and are hiring Delivery Drivers to meet growing customer demand as we approach the holiday season. DSPs offer competitive compensation, benefits, a great company culture, and opportunities for growth. No delivery experience required - apply today to schedule your in-person or virtual interview. DSPs are making on-the-spot job offers contingent on meeting eligibility requirements.

What You’ll Do:
As a Delivery Driver, you’ll drive an Amazon-branded vehicle, delivering 200-250 packages per day. You will be a delivery hero in the neighborhoods you serve - delivering hundreds of smiles to customers every day in the form of critical supplies, household goods, toys and so much more. You can expect to work 4-5 days per week and up to 10 hours per day.

Why You’ll Love Working For a DSP:
Earn more: competitive compensation starting at $17.50 per hour
Compelling Benefits: paid time off and health insurance for all full time employees
Independence: spend the majority of your day on the road delivering smiles to customers
Stay active: you’ll be on the move during your shift as you deliver packages from the delivery vehicle to the customer’s doorstep
Professional growth: many DSPs offer career growth opportunities such as moving into Lead Driver, Dispatcher, or Operations Manager roles, DOT certification, and professional development and training
Team environment: a fun, fast-paced, and supportive company culture
Equal opportunity employer: DSP is an equal opportunity employer and does not discriminate on the basis of race, national origin, gender, gender identity, sexual orientation, protected veteran status, disability, age, or other legally protected status.
What You’ll Need:
Must be at least 21 years old
Must have a valid driver's license within the state of employment
Must be able to move boxes up to 50 lbs., with or without reasonable accommodation
Health and safety are always a top priority for Amazon and the Delivery Service Partners Amazon contracts with. In partnership with one another, Amazon and the DSPs continue to consult with medical and health experts, and take all recommended precautions to keep everyone healthy.
PandoLogic . Keywords: Delivery Person , Location: Rancho Cordova , CA - 95741 , PL: 502232187"
newDelivery Van Driver - No Experience Required!,Amazon Workforce Staffing,"Sacramento, CA 95826+18 locations",2021-11-02,,"Some roles offer set schedules and others will allow you to set your own schedule weekly.
Some locations allow you to set your own schedule on a weekly basis.",https://www.indeed.com/pagead/clk?mo=r&ad=-6NYlbfkN0Dq4vQYgMEQOEiQzIefT02VXlVGpQ3VAIEku7A3IjxLBCEzQa77temkS6gkvjOUGtq5Y9te1LOxqLAA-4MUmw3qU23HlEDJXTK-sOoGN9LG34PK4J8Ct8Of65WKQm6HabJiPC40z_dpB-YRcR4HLLtE4h2yNIUgfoprzh6BU1Kh3msMX577nXVED6EvexXJqbZoDslkgVYir1JGpom2Lk2zqQQ39Dwcl_QLTc1UIHS2UNMIAnPwbOMKWbj8xzdsphso3Q7gjpL1_EYHZk1gzRupA4EDOs7P3M4oDc8HzLrZWEmxw3Bd4Hxzugu4NNMwLW9zy2AZ-HZyVMICfGVu7siG7zJeSX7I5-_5tkJSBKno4Q3R_DxX2NpX9E-cqas0CWRzasZD9ZuPWSNSpCGqFuONYeJLhP66jSIYQTKcVbo-3H0r98qQydQiFYtRQLsadsYQ5LeGSKkKIkbWrjjCAuVP8rDsQ1_KzuJP6BIWMk2hVeOG85WWs2hp0ZcTw91d-1d9DS-pLrU4AQ==&p=1&fvj=0&vjs=3,"Amazon Delivery Station Warehouse Associate
Job Overview
You’ll be part of the dedicated Amazon team at the delivery station – the last stop before we deliver smiles to customers. Our fast-paced, physical roles receive trucks full of orders, then prepare them for delivery. You’ll load conveyor belts, and transport and stage deliveries to be picked up by drivers. You may even be part of the team that works with larger items, such as large screen TVs, furniture, and appliances, and be trained on how to use technology to handle these heavy bulk items.
Duties & Responsibilities
Some of your duties may include:
Receive and prepare inventory for delivery
Use technology like smartphones and handheld devices to sort, scan, and prepare orders
View prompts on screens and follow direction for some tasks
Build, wrap, sort, and transport pallets and packages
Receive truck deliveries
You’ll also need to be able to:
Lift up to 49 pounds
Stand, walk, push, pull, squat, bend, and reach during shifts
Use carts, dollies, hand trucks, and other gear to move items around
Go up and down stairs (where applicable)
Work at a height of up to 40 feet on a mezzanine (where applicable)
What it’s like at an Amazon Delivery Station
Safety. Your safety is important to us, so we provide protective gear. All teams share safety tips daily.
Surroundings. You’ll be working around moving machines – order pickers, stand-up forklifts, turret trucks, and mobile carts.
Activity. Some activities may require standing in one place for long periods, walking around, or climbing stairs.
Temperature. Even with climate controls, temperatures can vary between 60°F and 90°F in some parts of the warehouse; on hot days, temperatures can be over 90°F in the truck yard or inside trailers.
Noise level. It can get noisy at times. We provide hearing protection if you need it.
Dress code. Relaxed, with a few rules to follow for safety. Comfortable, closed-toe shoes are required. Depending on the role or location, Amazon provides a $110 Zappos gift code towards the purchase of shoes, in order to have you prepared for your first day on the job.
Why You'll Love this Job
Stay busy. You and your team are engaged the entire shift.
Schedule options. Full-time (40 hours), reduced-time (30-36 hours) or part-time (20 hours), depending on location. Some roles offer set schedules and others will allow you to set your own schedule weekly.
Flexible shifts. Depending on your schedule, shift times will vary to ensure we meet customer-promised delivery times. Extra hours may be added to your schedule depending on business activity. Some locations allow you to set your own schedule on a weekly basis.
Anytime Pay. You can instantly cash out up to 70% of your earnings immediately after your shift (for select employee groups, within select businesses). Learn more about Anytime Pay.
Career advancement. We have made a pledge to upskill our employees and offer a variety of free training and development programs, and we also have tuition reimbursement options for select employee groups. See where your Amazon journey can take you.
New skills. Depending on the role and location, you’ll learn how to use the latest Amazon technology – including handheld devices and robotics.
Team environment. Work on small or large teams that support each other.
Why You’ll Love Amazon
Many of our jobs come with great benefits – including healthcare, parental leave, ways to save for the future, and opportunities for career advancement – all in a safe and inclusive environment that’s been ranked among the best workplaces in the world. Some offerings are dependent upon the role, work schedule, or location, and can include the following:
Competitive wage paid weekly, with overtime for more than 40 hours
Healthcare (medical, dental, vision, prescription drugs)
Medical Advice Line
Network of Support (health & well-being on and off the job)
Adoption Assistance
Maternity and Parental Leave
401(k) savings plan
Paid Time Off (PTO)
Holiday pay opportunities
Employee discounts
Basic life insurance
AD&D insurance
Company-paid Short-Term and Long-Term Disability
On-the-job training and skills development
Employee Assistance Program
Tuition reimbursement
Learn more about Amazon Benefits and Culture
https://hiring.amazon.com/why-amazon/benefits#/
https://hiring.amazon.com/why-amazon/culture#/
Requirements:
Candidates must be 18 years or older with the ability to understand and adhere to all job requirement and safety guidelines.
How To Get Started
You can begin by applying below. If you need help with your application or to learn more about our hiring process, you can find support here: https://hiring.amazon.com/hiring-process#/.

Amazon remains open as an essential business to serve our communities delivering critical supplies directly to the doorsteps of people who need them. Find out what Amazon is doing to provide a safe environment for employees at this time on our COVID-19 FAQ page.

Amazon is committed to a diverse and inclusive workplace. Amazon is an equal opportunity employer and does not discriminate on the basis of race, national origin, gender, gender identity, sexual orientation, protected veteran status, disability, age, or other legally protected status. For individuals with disabilities who would like to request an accommodation, please visit https://hiring.amazon.com/people-with-disabilities#/."
newDelivery Van Driver - No Experience Required!,FedEx Ground PH US,"Sacramento, CA 95824+1 location",2021-11-05,,"Valuable employee discounts on things like cell phone plans, electronics, cars and restaurants.
10pm Fri-10am Mon from 10/1/21 -1/3/22.",https://www.indeed.com/pagead/clk?mo=r&ad=-6NYlbfkN0DKSKBiX51o_U0mnvS3MCttSNYKTUV5bD6Cr9AMnRANOhbzhLwnG096uSiJfOuXwdMixiYhvsOXEryFJUZPSc9VS-dNdLvpuNVOqsLVbTBwkqChAIbz44okGzAjS_jetog7aAN3O5Bs4HGcBnZXYHnSJ-dv0A2rsHd-uhbaKggy_fqspuWFJxUeDB0aI3v2xMkMJtNHwIczvqKdLbq8odxZ5w9PUHvHxH_jWc--D93AB9H63O1WnPjcOcHWEa4vgZyot3KiGWbpbS0FycmV8zHXy7joDj5FMcNjcJBXbGWmlIECBiNNDm0CRlSeItmvXmA3ZXgK8EeE4tIPBE3Dd3aZ3pHXPlzto-e4MaN688y8A5D3iqCGBeAbRrNIl0C1p6wms3ruhSvMRqcLwPc3luL43ERXMgCKOxiEGEKUMcStHPLA1xmE7wnf7X4P3c7FqRp6f4YyEF4nZ_YZIFp9YbsGl5Qv0Ahnto3fwKzdaOMjIVZ2El9biDUaEWxDNrpIpsAy3khlLnAd62sdM6uZtDo2hLMAPgfZpbVa83t7yXAEHror51CuDefbNIPn3tF-UyJTMqh6WI1aHSvBGwtEbLqQHvHfrpAzlls=&p=2&fvj=0&vjs=3,"IMMEDIATE OPENINGS!

Come for a job and stay for a career! FedEx Ground is part of the rapidly growing warehouse and transportation sector that helps keep America, and our economy, moving. Be part of a winning team and workplace community that cares about who you are as an individual, and your safety in the workplace.

Perks and Benefits at FedEx Ground

Competitive wages paid weekly for both full and part time opportunities

$5,250 tuition reimbursement every year with no lifetime cap! All employees are eligible for this awesome benefit on their first day of employment!

Generous paid time off program – work your way up to 5 weeks of PTO a year!

Medical, dental and vision benefits after a short waiting period.

Flexible scheduling that helps balance your work and personal life.

Valuable employee discounts on things like cell phone plans, electronics, cars and restaurants.

Free Purple Pathways career development program for all FedEx Ground employees.

Paid parental leave for both moms and dads!

Employee networks, and diversity, equity and inclusion programs available for all employees.



What you can expect at FedEx Ground:

Fast paced and physical warehouse work – why pay for a gym membership when you can get paid while working out?

Warehouse duties include loading, unloading, and sorting of packages of various sizes.

Part time FedEx Ground employees work one shift a day; full time FedEx Ground employees work two shifts.

Shift lengths vary based on package volume – generally part time employees work between 3 and 6 hours a day. Full time employees can expect to work between 6 and 10 hours.

Overtime paid after 40 hours a week.

Reasonable accommodations are available for qualified individuals with disabilities.

Address: 8200 Elder Creek Road
City: Sacramento
State: California
Zip Code: 95824
Domicile Location: FXG-US/USA/P958/Sacramento Hub
Additional Location Information: Earn up to $22.75 per hour

$2/Hr Differential on the weekend
10pm Fri-10am Mon from 10/1/21 -1/3/22

Additional $1/Hr Enhancement for ALL Package Handlers/PH Trainers/Switchers
10/3/21 - 1/1/22

$50 additional on Weekends (Sat &/or Sun)
Part Time Package Handlers working 25+ hrs. earn $100 extra each week!

Apply for FT once you get hired on as PT and work 40+ hrs. and earn $200 extra each week!
Go PT to FT and get an additional $1/hr. added to your current hourly rate!

Sign on Service Milestone Bonus 10/3/21 - 1/1/22
$100 (30 Days)
$150 (60 Days)
$250 (90 Days)
EEO Statement
FedEx Ground is an equal opportunity / affirmative action employer (Minorities/Females/Disability/Veterans) committed to a diverse workforce"
newDelivery Van Driver - No Experience Required!,Amazon Workforce Staffing,"Rancho Cordova, CA 95742+29 locations",2021-10-23,,"Some roles offer set schedules and others will allow you to set your own schedule weekly.
Some locations allow you to set your own schedule on a weekly basis.",https://www.indeed.com/pagead/clk?mo=r&ad=-6NYlbfkN0Dq4vQYgMEQOEiQzIefT02VXlVGpQ3VAIEku7A3IjxLBCEzQa77temkNUE9mW9pIJf27eHZePbDZPHV3wJ1WZwINSVD_cfzSkQ_BCAPJBHb4NNyGgnylgv5K2qdR1nEDOWhdtFqChOPBx7IxJB5X-Kfc-ziCvXmHWxmiFAX-jZtaCkWHcpo3PIOh_8JRNCRUJi-FeattOEoa7pIoHolkTyfrJM5E2kXuc2p1K11JAFVH9PSWOpyjamRYGKlfByOLRlA9TZsBBR7xpJluTMsXFiQSm-F3uB0F3F4tlSxgSXrroB9qzNtLaWMp-ckS6qPcHuMjLehgnmmNO6Xzf1Yu0NiTw4S-xwZb6ngnbxsFHd8EcFMjfRoRTsaM4NlfYpIPbHaJm253_OAX3_14lsrZ4lsNXuvJJ7vFZMhknizGJ1jukye3rCNr_TOiCx8POCKv0cVskRDrWqFSgKjB4nAfXLmxakztkPuwg0XGNhVJdv0chDmRwc3laa8MgKNvguuPc2RQpqJk1fweQ==&p=3&fvj=0&vjs=3,"Amazon Delivery Station Warehouse Associate
Job Overview
You’ll be part of the dedicated Amazon team at the delivery station – the last stop before we deliver smiles to customers. Our fast-paced, physical roles receive trucks full of orders, then prepare them for delivery. You’ll load conveyor belts, and transport and stage deliveries to be picked up by drivers. You may even be part of the team that works with larger items, such as large screen TVs, furniture, and appliances, and be trained on how to use technology to handle these heavy bulk items.
Duties & Responsibilities
Some of your duties may include:
Receive and prepare inventory for delivery
Use technology like smartphones and handheld devices to sort, scan, and prepare orders
View prompts on screens and follow direction for some tasks
Build, wrap, sort, and transport pallets and packages
Receive truck deliveries
You’ll also need to be able to:
Lift up to 49 pounds
Stand, walk, push, pull, squat, bend, and reach during shifts
Use carts, dollies, hand trucks, and other gear to move items around
Go up and down stairs (where applicable)
Work at a height of up to 40 feet on a mezzanine (where applicable)
What it’s like at an Amazon Delivery Station
Safety. Your safety is important to us, so we provide protective gear. All teams share safety tips daily.
Surroundings. You’ll be working around moving machines – order pickers, stand-up forklifts, turret trucks, and mobile carts.
Activity. Some activities may require standing in one place for long periods, walking around, or climbing stairs.
Temperature. Even with climate controls, temperatures can vary between 60°F and 90°F in some parts of the warehouse; on hot days, temperatures can be over 90°F in the truck yard or inside trailers.
Noise level. It can get noisy at times. We provide hearing protection if you need it.
Dress code. Relaxed, with a few rules to follow for safety. Comfortable, closed-toe shoes are required. Depending on the role or location, Amazon provides a $110 Zappos gift code towards the purchase of shoes, in order to have you prepared for your first day on the job.
Why You'll Love this Job
Stay busy. You and your team are engaged the entire shift.
Schedule options. Full-time (40 hours), reduced-time (30-36 hours) or part-time (20 hours), depending on location. Some roles offer set schedules and others will allow you to set your own schedule weekly.
Flexible shifts. Depending on your schedule, shift times will vary to ensure we meet customer-promised delivery times. Extra hours may be added to your schedule depending on business activity. Some locations allow you to set your own schedule on a weekly basis.
Anytime Pay. You can instantly cash out up to 70% of your earnings immediately after your shift (for select employee groups, within select businesses). Learn more about Anytime Pay.
Career advancement. We have made a pledge to upskill our employees and offer a variety of free training and development programs, and we also have tuition reimbursement options for select employee groups. See where your Amazon journey can take you.
New skills. Depending on the role and location, you’ll learn how to use the latest Amazon technology – including handheld devices and robotics.
Team environment. Work on small or large teams that support each other.
Why You’ll Love Amazon
Many of our jobs come with great benefits – including healthcare, parental leave, ways to save for the future, and opportunities for career advancement – all in a safe and inclusive environment that’s been ranked among the best workplaces in the world. Some offerings are dependent upon the role, work schedule, or location, and can include the following:
Competitive wage paid weekly, with overtime for more than 40 hours
Healthcare (medical, dental, vision, prescription drugs)
Medical Advice Line
Network of Support (health & well-being on and off the job)
Adoption Assistance
Maternity and Parental Leave
401(k) savings plan
Paid Time Off (PTO)
Holiday pay opportunities
Employee discounts
Basic life insurance
AD&D insurance
Company-paid Short-Term and Long-Term Disability
On-the-job training and skills development
Employee Assistance Program
Tuition reimbursement
Learn more about Amazon Benefits and Culture
https://hiring.amazon.com/why-amazon/benefits#/
https://hiring.amazon.com/why-amazon/culture#/
Requirements:
Candidates must be 18 years or older with the ability to understand and adhere to all job requirement and safety guidelines.
How To Get Started
You can begin by applying below. If you need help with your application or to learn more about our hiring process, you can find support here: https://hiring.amazon.com/hiring-process#/.

Amazon remains open as an essential business to serve our communities delivering critical supplies directly to the doorsteps of people who need them. Find out what Amazon is doing to provide a safe environment for employees at this time on our COVID-19 FAQ page.

Amazon is committed to a diverse and inclusive workplace. Amazon is an equal opportunity employer and does not discriminate on the basis of race, national origin, gender, gender identity, sexual orientation, protected veteran status, disability, age, or other legally protected status. For individuals with disabilities who would like to request an accommodation, please visit https://hiring.amazon.com/people-with-disabilities#/."
newDelivery Van Driver - No Experience Required!,United Parcel Service,"Sacramento, CA 95813 (South East area)+48 locations",2021-11-05,,"Minimum state-required auto insurance.
Proof of a registered vehicle for use.
No moving violations within the last 12 months.
21 years of age or older.",https://www.indeed.com/pagead/clk?mo=r&ad=-6NYlbfkN0BK0M4khb0GT18iO0N9Gjdj3ZFi-XahZOvEPMGxE5CyEZX74OMakYHzvwC7PAcVnd8T7MqNoY_KH1FON6Q0H3C8asUeHW-keLkUBoHXOxCId2RGxNXNfJZTGIdiQyOf-yFm1dgft9W9jtIEVFZOWkd22COrT5Teu-EyQX5DToISPoyFUqo5GtIh4Ii1QeR2pbweka4_pXPpaLpGM8XTWdUTXmlLxrsHFBhnnJxoxJLhq0Z3MEibBz-GoPCsPP4PfxjjAsQyMQWr5_-S94qmfBPfApMXEzap_LGnbayM3nx3nygoisLW49M9TjComcuewRMWoL0u2iQ7uUi8pdXPDCQDcQf9D-_S9ZdEff_O3I9AyxJFldq9CjVTPXTcFMib423iK0cdY6dm5vqlTRSYqDuyTHCWF_S_uRq3tV2Yn8yPvg==&p=4&fvj=0&vjs=3,"$28 / hour + 56 cents per mile

As a Personal Vehicle Driver, you’ll enjoy a fast-paced, physical position that gets you outdoors and connecting with customers. From the driver’s seat of your own car, find out what you’ll become at UPS.

About the role:

Lift, lower and carry packages up to 70 pounds

Full time, opportunity to work eight hours, Monday-Friday

Saturday and holiday work may be available/required

About you:

21 years of age or older

Valid driver’s license

No at fault accidents within the last 12 months

No moving violations within the last 12 months

Proof of a registered vehicle for use

Minimum state-required auto insurance

Comply with company appearance guidelines

An applicant or employee may request an exception or change to, or an accommodation of, any condition of employment (including the UPS Uniform and Personal Appearance Guidelines) because of a sincerely held religious belief or practice.

About your vehicle:

No other company logos or markings

No bumper stickers, political stickers, offensive markings

Vehicles must be under 10,000 pounds and have a covered and secured bed

UPS is an equal opportunity employer. UPS does not discriminate on the basis of race/color/religion/sex/national origin/veteran/disability/age/sexual orientation/gender identity or any other characteristic protected by law
We welcome those with experience in jobs such as Warehouse Associate, Medication Delivery Driver, and Light Truck or Delivery Services Driver and others in the Logistics to apply."
newDelivery Van Driver - No Experience Required!,United Parcel Service,"Gold River, CA 95670+55 locations",2021-10-25,,"Shift: Sunrise/Preload (4:00 AM - 8:00 AM) Twilight (4:00 PM - 10:00 PM).
The ability to lift up to 70 lbs.
Up to $25,000 in tuition assistance.",https://www.indeed.com/pagead/clk?mo=r&ad=-6NYlbfkN0BK0M4khb0GT18iO0N9Gjdj3ZFi-XahZOvEPMGxE5CyEZX74OMakYHzyMwNDV6rq6lVzf68u3RfuKC-gO2MvpPZi3YTwN78kaJ0SdPLXaRbvofdrll2yx-ES8zcG9HHt4sX0z5tUwS2SmQzpO8okg_bUX5gr7ny0KhYPZ55-AfeMezWVR2ZfGl9k3-4eUtTk2AU-8qP1Q1ExFv8b5x3ZgEECAKZueOQmRPA1SJE-GOs56O-Bl-Qi9fS9qZoItOV-8Cm3opIPPdE4BNUpAdIU3QaXwgLUGrwIrvBCXwemjtfjnkuuuCtM4ml74HP5HaRW9FOhiS5Y50dpVT-nt47N4A7eRpm-KVQ8CeORnUSKSjMjbEo7X7s3-hdXh3T23fNg8Ocz2PvbKLWxAMekB_W1YpCMfbyfIrLKII=&p=5&fvj=0&vjs=3,"$16 / hour
Shift: Sunrise/Preload (4:00 AM - 8:00 AM) Twilight (4:00 PM - 10:00 PM)


UPS Quick Apply

Applying for this role online is quick and easy – and you could even schedule your first day of work within 30 minutes!

The steps are simple:

1) Create a profile so you can save your place in the process and keep track of your progress.

2) Watch a couple of short videos to see what the job is really like.

3) Provide some basic information in our online application process.

4) Receive your job offer and schedule your first day of work.

SHIFT YOUR TEAM

Who exactly are UPS Warehouse Workers? Also known as Package Handlers, many of our WarehouseWorkers start out as seasonal employees but we also hire warehouse workers throughout the year. They are a diverse, collaborative, energetic team who enjoy fast-paced work.

So what does it take to make it through a busy shift moving boxes and packages?

The ability to lift up to 70 lbs

Stamina – this is a workout like no other!

Legal right to work in the U.S.

An eye for detail

Reliability, responsibility, and a really good pair of work shoes

SHIFT YOUR BENEFITS

What’s in it for you? You’ve read about the quick application process, tight team, and active work… but what else do we offer to that makes being a UPS Warehouse Worker such a great gig?

Excellent weekly pay

Safe work environment

Up to $25,000 in tuition assistance

401(k)

Medical, dental and vision after waiting period

And so much more

SHIFT YOUR PURPOSE

So what is UPS all about? Well, you’re probably already familiar with us – we’re the brown trucks delivering everything from diapers and dish towels to holiday gifts and college care packages to life-saving medicines.

But we’re more than that. We’re also hardworking, efficient package handlers and friendly, focused drivers. We’re professionals working in finance, IT, engineering, marketing, and more. We are building our business ethically, safely, sustainably, and in an environmentally conscientious way. We are here to deliver what truly matters – to customers, communities, colleagues, the world, and you and your career.

UPS is an equal opportunity employer. UPS does not discriminate on the basis of race/color/religion/sex/national origin/veteran/disability/age/sexual orientation/gender identity or any other characteristic protected by law
We welcome those with experience in jobs such as General, General, and General and others in the General to apply."
